{
  "schema_version": "1.0.0",
  "as_of_utc": "2026-07-26T00:00:00Z",
  "study_id": "joss-issue-121-external-validation",
  "status": "NO_VERIFIED_EXTERNAL_OUTCOMES_YET",
  "measurement_policy": "docs/impact-measurement-policy.md",
  "counts": {
    "independent_reproductions": 0,
    "independent_human_reannotations": 0,
    "external_citations": 0,
    "accepted_upstream_corrections": 0,
    "measured_user_benefit_outcomes": 0,
    "protocol_adoptions": 0,
    "documented_productization_decision_changes": 0
  },
  "entries": [],
  "note": "Internal research completion, CI success, GitHub activity, submissions, downloads, views, clones, social impressions, and AI-generated review are reach or activity indicators and are not counted as verified external outcomes. Rejected, disputed, duplicate, and reversed claims must remain visible in the log."
}
